,All.proteins.identfied.from.the.DRM.fraction,X,X.1,X.2,X.3,X.4,V1
HNRNPK,P61978,Heterogeneous nuclear ribonucleoprotein K OS=Homo sapiens GN=HNRNPK PE=1 SV=1,0.387,0.165744784,4,0.05879,HNRNPK
SNRPD1,P62314,Small nuclear ribonucleoprotein Sm D1 OS=Homo sapiens GN=SNRPD1 PE=1 SV=1,0.658166667,0.161498504,6,0.58725,SNRPD1
HNRNPM,P52272,Heterogeneous nuclear ribonucleoprotein M OS=Homo sapiens GN=HNRNPM PE=1 SV=3,0.37,0.220955878,5,0.03313,HNRNPM
SYNCRIP,O60506,Heterogeneous nuclear ribonucleoprotein Q OS=Homo sapiens GN=SYNCRIP PE=1 SV=2,0.55175,0.297479831,4,0.32342,SYNCRIP
RPS7,P62081,40S ribosomal protein S7 OS=Homo sapiens GN=RPS7 PE=1 SV=1,0.542285714,0.230272223,14,0.14773,RPS7
SPTAN1,Q13813,"Spectrin alpha chain, brain OS=Homo sapiens GN=SPTAN1 PE=1 SV=3",0.485468354,0.216974052,79,0.0318,SPTAN1
NCL,P19338,Nucleolin OS=Homo sapiens GN=NCL PE=1 SV=3,0.823,0.11295685,9,0.92057,NCL
PDIA3,P30101,Protein disulfide-isomerase A3 OS=Homo sapiens GN=PDIA3 PE=1 SV=4,0.25,0.206324986,6,0.00591,PDIA3
VCP,P55072,Transitional endoplasmic reticulum ATPase OS=Homo sapiens GN=VCP PE=1 SV=4,0.809846154,0.289753587,13,0.92206,VCP
